{"classes":[{"name":"A","id":"c31","attributes":[],"methods":[],"position":{"x":181,"y":195},"size":{"width":105,"height":80}},{"name":"Class","id":"c43","attributes":[],"methods":[],"position":{"x":590,"y":160},"size":{"width":100,"height":70}}],"inheritances":[{"id":"c55","type":"","superClasses":["c43"],"subClasses":["c31"],"position":{"x":450,"y":210},"size":{"width":40,"height":40}}],"associations":[],"assocWithClass":[]}
